"Earthquake phase","Event",00:00:00.008,0.008,00:00:00.714,0.714,00:00:00.706,0.706,"Immediately after"
"P_1","pink top wearing girl",00:00:00.004,0.004,00:00:00.714,0.714,00:00:00.710,0.71,"standing (id: 8341)"
"P_2","black hoodie wearing girl",00:00:00.004,0.004,00:00:00.714,0.714,00:00:00.710,0.71,"standing (id: 8407)"
"2_Participants","sitting people",00:00:00.004,0.004,00:00:00.714,0.714,00:00:00.710,0.71,"sitting (id: 8428, 8425)"
"P_3","checked shirt wearing man",00:00:00.008,0.008,00:00:00.714,0.714,00:00:00.706,0.706,"move under a furniture"
"P_4","yellow tshirt wearing man",00:00:00.008,0.008,00:00:00.714,0.714,00:00:00.706,0.706,"move under a furniture (id: 8371)"
