"Earthquake Phase","Event",00:00:00.050,0.05,00:00:23.500,23.5,00:00:23.450,23.45,"Immediately after"
"P_1","light blue tshirt wearing man",00:00:00.025,0.025,00:00:23.500,23.5,00:00:23.475,23.475,"hold onto a structure (id: 14991)"
"P_2","dark blue shirt wearing man",00:00:11.125,11.125,00:00:23.500,23.5,00:00:12.375,12.375,"walking (id: 15028)"
"P_3","lady hold onto door, right side",00:00:00.050,0.05,00:00:05.275,5.275,00:00:05.225,5.225,"hold onto a structure (id: 15022)"
"P_3","lady hold onto door, right side",00:00:09.650,9.65,00:00:16.250,16.25,00:00:06.600,6.6,"running (id: 15025)"
"7_Participants","Standing people",00:00:00.000,0.0,00:00:23.500,23.5,00:00:23.500,23.5,"standing"
